{"descriptorVersion":1,"themePublicId":"100001","themeVersion":"1.0.0","schemaVersion":1,"manifestSha256":"f94d5431fecfc044a904c255fa874ed168b17dbf6b599c1880f70cc17aafeece","packageSha256":"0d68f984061b05548cb99a84ae621d5d6e6138f009e3644c8ff72e7b476cf5a3","packageByteSize":1933,"publishedAt":"2026-07-26T08:00:00.000Z","signingKeyId":"theme-alpha-2026-01"}
